{
  "reportVersion": "v1",
  "evidenceType": "runtime-assertions",
  "generatedAt": "2026-03-04",
  "provenance": {
    "commitSha": "653180d2a7c1ef45021f90229bd09b4ac90fa5f0",
    "ciJobId": "github-run-local:release-gates",
    "capturedAt": "2026-03-04T06:33:51.741865Z",
    "testBundleHash": "d6cda00fa0e2570df24ac065a551a94673ae20957e5005735efd7bb098271e7a"
  },
  "source": {
    "testResultsPath": "artifacts/visual-system/runtime-accessibility-test-results.json",
    "sourceMode": "test-run",
    "testMode": "full",
    "requiredTestMode": "full",
    "executedTests": {
      "ios": 3,
      "android": 3,
      "total": 6
    },
    "suiteIds": {
      "ios": "visual-accessibility-full-ios",
      "android": "visual-accessibility-full-android"
    }
  },
  "platforms": {
    "ios": {
      "runner": "xctest-ui",
      "scenarios": [
        {
          "flowId": "planning",
          "passed": true,
          "assertions": {
            "screenReaderLabels": true,
            "focusOrder": true,
            "contrast": true,
            "reducedMotion": true,
            "nonColorSemantics": true
          }
        },
        {
          "flowId": "dashboard",
          "passed": true,
          "assertions": {
            "screenReaderLabels": true,
            "focusOrder": true,
            "contrast": true,
            "reducedMotion": true,
            "nonColorSemantics": true
          }
        },
        {
          "flowId": "settings",
          "passed": true,
          "assertions": {
            "screenReaderLabels": true,
            "focusOrder": true,
            "contrast": true,
            "reducedMotion": true,
            "nonColorSemantics": true
          }
        }
      ]
    },
    "android": {
      "runner": "android-instrumentation",
      "scenarios": [
        {
          "flowId": "planning",
          "passed": true,
          "assertions": {
            "screenReaderLabels": true,
            "focusOrder": true,
            "contrast": true,
            "reducedMotion": true,
            "nonColorSemantics": true
          }
        },
        {
          "flowId": "dashboard",
          "passed": true,
          "assertions": {
            "screenReaderLabels": true,
            "focusOrder": true,
            "contrast": true,
            "reducedMotion": true,
            "nonColorSemantics": true
          }
        },
        {
          "flowId": "settings",
          "passed": true,
          "assertions": {
            "screenReaderLabels": true,
            "focusOrder": true,
            "contrast": true,
            "reducedMotion": true,
            "nonColorSemantics": true
          }
        }
      ]
    }
  }
}
