{
  "reportVersion": "v1",
  "evidenceType": "runtime-assertions",
  "generatedAt": "2026-03-03",
  "provenance": {
    "commitSha": "b6f443283405fefff67b775b9d03f734cd233cf7",
    "ciJobId": "github-run-local:release-gates",
    "capturedAt": "2026-03-03T21:50:59.811720Z",
    "testBundleHash": "12afcf01530674f1207cbd8117d3f0c02f85559b5c960aa1c8439c4bebf4a861"
  },
  "source": {
    "testResultsPath": "artifacts/visual-system/runtime-accessibility-test-results.json",
    "sourceMode": "test-run",
    "testMode": "smoke",
    "requiredTestMode": "smoke",
    "executedTests": {
      "ios": 3,
      "android": 3,
      "total": 6
    },
    "suiteIds": {
      "ios": "visual-accessibility-smoke-ios",
      "android": "visual-accessibility-smoke-android"
    }
  },
  "platforms": {
    "ios": {
      "runner": "xctest-ui",
      "scenarios": [
        {
          "flowId": "planning",
          "passed": true,
          "assertions": {
            "screenReaderLabels": true,
            "focusOrder": true,
            "contrast": true,
            "reducedMotion": true,
            "nonColorSemantics": true
          }
        },
        {
          "flowId": "dashboard",
          "passed": true,
          "assertions": {
            "screenReaderLabels": true,
            "focusOrder": true,
            "contrast": true,
            "reducedMotion": true,
            "nonColorSemantics": true
          }
        },
        {
          "flowId": "settings",
          "passed": true,
          "assertions": {
            "screenReaderLabels": true,
            "focusOrder": true,
            "contrast": true,
            "reducedMotion": true,
            "nonColorSemantics": true
          }
        }
      ]
    },
    "android": {
      "runner": "android-instrumentation",
      "scenarios": [
        {
          "flowId": "planning",
          "passed": true,
          "assertions": {
            "screenReaderLabels": true,
            "focusOrder": true,
            "contrast": true,
            "reducedMotion": true,
            "nonColorSemantics": true
          }
        },
        {
          "flowId": "dashboard",
          "passed": true,
          "assertions": {
            "screenReaderLabels": true,
            "focusOrder": true,
            "contrast": true,
            "reducedMotion": true,
            "nonColorSemantics": true
          }
        },
        {
          "flowId": "settings",
          "passed": true,
          "assertions": {
            "screenReaderLabels": true,
            "focusOrder": true,
            "contrast": true,
            "reducedMotion": true,
            "nonColorSemantics": true
          }
        }
      ]
    }
  }
}
